{
    "LogPath": "/media/backups/log",
    "DropPath": [
        "/media/backups/drop",
        "/media/backups/sftp-share/dockerhost1/drop"
    ],
    "HostedSources": [
        {
            "Path": "/media/backups/sftp-share/lc3win",
            "IdleTimeout": "00:10:00",
            "CreateSnapshotCommand": "ResticBackup.ps1 -HostedPath '{Path}'"
        }
    ],
    "BackupsetAssemblyPath": "/media/backups/temp-set-assembly",
    "BackupsetStorePath": "/media/backups/backupsets",
    "TickInterval": "00:00:15",
    "LogfileRetentionDuration": "30:00:00:00",
    "BackupSetFinishedCommand": "ResticBackup.ps1 -BackupSetPath '{BackupSetPath}'",
    "DropFileWriteTimeout": "00:00:30",
    "BackupsetAssemblyTimeout": "00:10:00"
}